{
  "record_version": 1,
  "kind": "check",
  "recorded_at": "2026-10-27T05:18:19+00:00",
  "core": {
    "file": "yabause_libretro.so",
    "sha256": "1530b0a3c7f2ff762e4b02e22f016be6753a7f3864306cf17ca810bccee0e5c4",
    "repo": "https://github.com/libretro/yabause",
    "commit": "8926b0c6c347f8c5c755911ddb0ac695420ffbf8",
    "build_command": "make -j8 in yabause/src/libretro, after setting yinit.mpegpath to <system>/mpeg_card.bin in libretro.c (the port sets it to NULL)",
    "compiler": [
      "GCC: (Ubuntu 13.3.0-6ubuntu2~24.04.1) 13.3.0"
    ],
    "library_name": "Yabause",
    "library_version": "v0.9.15 625bee35c"
  },
  "frontend": {
    "script": "scripts/core_probe.py",
    "commit": "8b12685c1652732828c146336a14a5fc265fffd3",
    "script_modified": false,
    "script_sha256": "a95ab54a8d8f9ecc5dc2a55fd0ab93ffc66fe6466e2d89eea56a1a95c17d858b"
  },
  "host": {
    "cpu_model": "13th Gen Intel(R) Core(TM) i9-13900K",
    "cpu_count": 12,
    "os": "Linux-6.18.54.1-microsoft-standard-WSL2-x86_64-with-glibc2.39",
    "kernel": "6.18.54.1-microsoft-standard-WSL2",
    "machine": "x86_64",
    "python": "3.12.3",
    "load_before": [
      2.41,
      4.58,
      5.69
    ],
    "load_after": [
      1.81,
      3.2,
      4.89
    ],
    "max_load": 6.0
  },
  "inputs": {
    "content": {
      "label": "authored Video CD: Big Buck Bunny 60 s, NTSC VCD 2.0 (identity.json beside the image)",
      "sha1": "150cfb81d3c844f0721f2864073a33e326492d46",
      "size": 172,
      "tracks": [
        {
          "file": "bbb_vcd.bin",
          "sha1": "e7952e60928dba7f3ceb6c3316894f96ad24e175",
          "size": 12169248
        }
      ]
    },
    "options": {
      "yabause_numthreads": "1"
    },
    "env": {
      "LD_PRELOAD": "libfaketime.so.1 sha256:7ac8a1cdff1b627548de11513fddedd75014f5b041e9ae9054a634bb04aa7982",
      "FAKETIME": "2000-01-01 00:00:00",
      "FAKETIME_DONT_FAKE_MONOTONIC": "1"
    },
    "frames": 3000,
    "warmup": 0,
    "repetitions": 2,
    "presses": [
      {
        "frame": 1300,
        "button": 0,
        "length": 15
      },
      {
        "frame": 1900,
        "button": 3,
        "length": 15
      }
    ],
    "observables": [
      "frame_sha1",
      "video_sha1",
      "audio_sha1",
      "state_sha1",
      "frame_hashes"
    ],
    "frame_hash_every": 150,
    "joypad_ports": 2
  },
  "variants": [
    {
      "label": "mpeg_card.bin",
      "system_files": {
        "mpeg_card.bin": "2f5ebd434f6d5b82e93d03e5626007bd5380f652",
        "sega_101.bin": "df94c5b4d47eb3cc404d88b33a8fda237eaf4720"
      },
      "repetitions": [
        {
          "loaded": true,
          "library_name": "Yabause",
          "library_version": "v0.9.15 625bee35c",
          "fps_nominal": 60.0,
          "frames": 3000,
          "warmup": 0,
          "wall_s": 10.042349844006822,
          "observables": {
            "frame_sha1": "1b5cd15c0e874315a9df0cd89c790dac0d4ca672",
            "video_sha1": "c89177305da310bd329a17d0f4a5e60ffe5cdece",
            "audio_sha1": "8eefdabcbbb9f662de4b0d04087df5bd18ba6e45",
            "state_sha1": "1a9a2509e0e0574373a97c243c6bebededd63cd8",
            "frame_hashes": [
              [
                0,
                "d87e1556593b17c10facada78fe3b3a35c0f7552"
              ],
              [
                150,
                "b2f9f19e66b8981bf1547e970a8a3f6637b6934e"
              ],
              [
                300,
                "06d859bca35a5194fbb8b4300dab66643988629f"
              ],
              [
                450,
                "b6064ea4357cf541eac46afc7f167ed7878aab1c"
              ],
              [
                600,
                "d87e1556593b17c10facada78fe3b3a35c0f7552"
              ],
              [
                750,
                "cbe0871893b854ec3a8ae72b5f1be8bed18a5308"
              ],
              [
                900,
                "6d9c3c739167faef80b27a5e88eeefe46a395264"
              ],
              [
                1050,
                "6c20cfa2ca401bbbab7a92aa4a37910b54baa70c"
              ],
              [
                1200,
                "7471401fb6d263292f57f8164a5c34994485c205"
              ],
              [
                1350,
                "d939ec9ce85638cb231ac6d9703b0519e484c483"
              ],
              [
                1500,
                "7915940919a745bede34db6d4fc34d975894a6eb"
              ],
              [
                1650,
                "8859e95bce7870e8417ff0e430a38b96d338b115"
              ],
              [
                1800,
                "50283a9425d3ff49a41cfbff6c9cce958ad93a54"
              ],
              [
                1950,
                "42c55858c8e50732b4eb0d27bea02bfaa42d5755"
              ],
              [
                2100,
                "8e9b78e2f51a1bc9fdb283d78da374d80fbdd501"
              ],
              [
                2250,
                "da5991488a97c6380aec0ae2cc24e9b1e61f02e5"
              ],
              [
                2400,
                "35ddd6b3c8633679962f66707fd0400d845c4576"
              ],
              [
                2550,
                "f11aef5b17afb13e0cfbd150c6b8c5f8a8558c3c"
              ],
              [
                2700,
                "d64dfa5bfff5437930211a85fe2decd5fda73cc4"
              ],
              [
                2850,
                "e213b5ae0b3baf3a44e056160499dc32b7291357"
              ],
              [
                3000,
                "1b5cd15c0e874315a9df0cd89c790dac0d4ca672"
              ],
              [
                3000,
                "1b5cd15c0e874315a9df0cd89c790dac0d4ca672"
              ],
              [
                3000,
                "1b5cd15c0e874315a9df0cd89c790dac0d4ca672"
              ],
              [
                3000,
                "1b5cd15c0e874315a9df0cd89c790dac0d4ca672"
              ],
              [
                3000,
                "1b5cd15c0e874315a9df0cd89c790dac0d4ca672"
              ],
              [
                3000,
                "1b5cd15c0e874315a9df0cd89c790dac0d4ca672"
              ]
            ]
          },
          "logs": [
            {
              "frame": 0,
              "level": "warn",
              "text": "<system>/saturn_bios.bin NOT FOUND"
            },
            {
              "frame": 0,
              "level": "debug",
              "text": "Starting emulation"
            },
            {
              "frame": 0,
              "level": "debug",
              "text": "Enabling cheevos"
            }
          ],
          "options_declared": {
            "yabause_frameskip": [
              "disabled",
              "enabled"
            ],
            "yabause_force_hle_bios": [
              "disabled",
              "enabled"
            ],
            "yabause_addon_cartridge": [
              "none",
              "1M_ram",
              "4M_ram"
            ],
            "yabause_multitap_port1": [
              "disabled",
              "enabled"
            ],
            "yabause_multitap_port2": [
              "disabled",
              "enabled"
            ],
            "yabause_numthreads": [
              "4",
              "1",
              "2",
              "8",
              "16",
              "32"
            ]
          },
          "env_unanswered": {
            "8": 1,
            "11": 1,
            "13": 1,
            "28": 1,
            "35": 1,
            "36": 1,
            "42": 1,
            "44": 1,
            "49": 3000,
            "51": 1,
            "57": 1
          },
          "last_frame_size": [
            320,
            224
          ],
          "input_queries": 78000,
          "input_pressed": 30,
          "files_opened": [
            {
              "path": "sega_101.bin",
              "sha1_after": "df94c5b4d47eb3cc404d88b33a8fda237eaf4720",
              "sha1_staged": "df94c5b4d47eb3cc404d88b33a8fda237eaf4720"
            },
            {
              "path": "mpeg_card.bin",
              "sha1_after": "2f5ebd434f6d5b82e93d03e5626007bd5380f652",
              "sha1_staged": "2f5ebd434f6d5b82e93d03e5626007bd5380f652"
            }
          ],
          "files_probed_absent": [],
          "tracing": "strace",
          "ms_per_frame": 3.3474499480022737,
          "fps": 298.7348625172993
        },
        {
          "loaded": true,
          "library_name": "Yabause",
          "library_version": "v0.9.15 625bee35c",
          "fps_nominal": 60.0,
          "frames": 3000,
          "warmup": 0,
          "wall_s": 10.058107044023927,
          "observables": {
            "frame_sha1": "1b5cd15c0e874315a9df0cd89c790dac0d4ca672",
            "video_sha1": "c89177305da310bd329a17d0f4a5e60ffe5cdece",
            "audio_sha1": "8eefdabcbbb9f662de4b0d04087df5bd18ba6e45",
            "state_sha1": "1a9a2509e0e0574373a97c243c6bebededd63cd8",
            "frame_hashes": [
              [
                0,
                "d87e1556593b17c10facada78fe3b3a35c0f7552"
              ],
              [
                150,
                "b2f9f19e66b8981bf1547e970a8a3f6637b6934e"
              ],
              [
                300,
                "06d859bca35a5194fbb8b4300dab66643988629f"
              ],
              [
                450,
                "b6064ea4357cf541eac46afc7f167ed7878aab1c"
              ],
              [
                600,
                "d87e1556593b17c10facada78fe3b3a35c0f7552"
              ],
              [
                750,
                "cbe0871893b854ec3a8ae72b5f1be8bed18a5308"
              ],
              [
                900,
                "6d9c3c739167faef80b27a5e88eeefe46a395264"
              ],
              [
                1050,
                "6c20cfa2ca401bbbab7a92aa4a37910b54baa70c"
              ],
              [
                1200,
                "7471401fb6d263292f57f8164a5c34994485c205"